{
  "schema_version": "amazon-launch-strategy.v1",
  "client": {"name": "Example Client", "brand": "Northstar", "account": "Northstar US", "marketplace": "US", "currency": "USD", "launch_date": "2026-09-01", "launch_timing_label": "September 1, 2026 and Weeks 1-13", "output_dir": "output/_fixtures/amazon-launch-strategy", "file_stem": "generic_amazon_launch_strategy"},
  "baseline": {"current_revenue": 0, "orders_by_product": {"daily-greens": 0}},
  "external_channels": {"current_meta_spend": 15000, "current_google_spend": 10000, "branded_search_contribution": 0.22, "planned_launch_support": "Maintain current spend and add Amazon launch creative."},
  "products": [
    {"id": "daily-greens", "name": "Daily Greens", "phase": "launch", "list_price": 49.99, "launch_price": 44.99, "coupon_pct": 0, "unit_economics": {"landed_cogs": 12, "amazon_fees": 10, "other_variable_costs": 3, "coupon_fee_per_redemption": 0, "discount_floor": 42.99}, "inventory": {"opening_stock": 500, "inbound": [{"week": 7, "units": 300}], "safety_stock": 100, "moq": 500, "lead_times": {"production_weeks": 4, "freight_weeks": 4, "fba_checkin_weeks": 2}}, "reviews": {"vine_eligible": true, "vine_units": 30}},
    {"id": "omega", "name": "Omega", "phase": "later", "phase_gate": "Listing and launch approval", "list_price": 39.99, "launch_price": 39.99, "coupon_pct": 0, "unit_economics": {"landed_cogs": 9, "amazon_fees": 8, "other_variable_costs": 2, "coupon_fee_per_redemption": 0, "discount_floor": 36.99}, "inventory": {"opening_stock": 0, "inbound": [], "safety_stock": 0, "moq": 500, "lead_times": {"production_weeks": 4, "freight_weeks": 4, "fba_checkin_weeks": 2}}, "reviews": {"vine_eligible": false, "vine_units": 0}}
  ],
  "ppc": {"phases": [
    {"id": "launch", "name": "Launch Discovery", "start_week": 1, "end_week": 4, "daily_budget_cap": 100, "objective": "Harvest search-term and conversion evidence.", "decision_gate": "Protect relevance and suppress waste."},
    {"id": "scale", "name": "Controlled Scale", "start_week": 5, "end_week": 8, "daily_budget_cap": 150, "objective": "Scale proven targets within stock and contribution limits.", "decision_gate": "Increase only proven targets."},
    {"id": "stabilize", "name": "Stabilize", "start_week": 9, "end_week": 13, "daily_budget_cap": 180, "objective": "Shift toward efficient repeatable coverage.", "decision_gate": "Set steady-state budget and targets."}
  ]},
  "scenarios": [
    {"id": "low", "label": "Low", "products": {"daily-greens": {"cpc": {"launch": 1.5, "scale": 1.4, "stabilize": 1.3}, "cvr": {"launch": 0.06, "scale": 0.07, "stabilize": 0.08}, "paid_clicks_per_week": {"launch": 30, "scale": 40, "stabilize": 50}, "organic_units_per_week": {"launch": 1, "scale": 2, "stabilize": 3}, "external_halo_units_per_week": {"launch": 1, "scale": 2, "stabilize": 3}, "halo_basis": "Explicit client sensitivity based on tracked branded traffic."}}},
    {"id": "base", "label": "Base", "products": {"daily-greens": {"cpc": {"launch": 1.6, "scale": 1.5, "stabilize": 1.4}, "cvr": {"launch": 0.08, "scale": 0.1, "stabilize": 0.11}, "paid_clicks_per_week": {"launch": 50, "scale": 70, "stabilize": 90}, "organic_units_per_week": {"launch": 2, "scale": 4, "stabilize": 7}, "external_halo_units_per_week": {"launch": 2, "scale": 4, "stabilize": 6}, "halo_basis": "Explicit client sensitivity based on tracked branded traffic."}}},
    {"id": "high", "label": "High", "products": {"daily-greens": {"cpc": {"launch": 1.8, "scale": 1.7, "stabilize": 1.6}, "cvr": {"launch": 0.1, "scale": 0.12, "stabilize": 0.14}, "paid_clicks_per_week": {"launch": 80, "scale": 110, "stabilize": 140}, "organic_units_per_week": {"launch": 4, "scale": 8, "stabilize": 12}, "external_halo_units_per_week": {"launch": 4, "scale": 7, "stabilize": 10}, "halo_basis": "Explicit client sensitivity based on tracked branded traffic."}}}
  ],
  "reviews": {"methods": ["vine", "request_a_review"], "vine": {"enabled": true}, "request_a_review": {"enabled": true}, "helium10_follow_up": {"enabled": false, "amazon_standard_template_only": true, "max_requests_per_order": 1, "deduplicate_with_seller_central": true, "incentive_or_custom_review_language": false}},
  "sources": [{"name": "Approved launch brief", "type": "Client brief", "locator": "fixture://launch-brief", "status": "Confirmed", "freshness": "2026-08-11", "notes": "Generic deterministic fixture."}],
  "owners": [{"decision": "Pricing and margin floor", "owner": "Finance", "status": "Confirmed", "next_confirmation": "Recheck before Day 0"}, {"decision": "Campaign build", "owner": "Amazon team", "status": "Planned", "next_confirmation": "Build paused campaigns after plan approval"}]
}
